{
  "kind": "qualification-record",
  "version": 1,
  "contractRef": "generation-contract-valid.json",
  "attempt": 2,
  "status": "QUALIFIED",
  "machineGates": [
    { "name": "validate-layout", "passed": true },
    { "name": "a11y-lint", "passed": true },
    { "name": "taste-lint", "passed": true },
    { "name": "content-lint", "passed": true },
    { "name": "ds-usage-lint", "passed": true },
    { "name": "ds-a11y", "passed": true }
  ],
  "renderedViewports": [1440, 768, 390],
  "mustCriteria": [{ "id": "must-cta", "covered": true }, { "id": "must-proof", "covered": true }],
  "unsupportedClaimCount": 0,
  "unresolvedFindings": []
}
